1_1,Liebe Ingo,Liebe N _|_|Pl,Ingo N Masc|_|Sg,"16.03.2012 Liebe Ingo , Wie gehts dir ?"
1_2,Liebe Ingo,Liebe N _|_|Pl,Ingo N Masc|_|Sg,"16.03.2012 Liebe Ingo , Wie gehts dir ?"
1_3,gehts,gehts N _,"16.03.2012 Liebe Ingo , Wie gehts dir ?"
2_4,eine Arbeit,eine ART Indef|Fem|Acc|Sg,Arbeit N Fem|Acc|Sg,Ich habe eine Arbeit für dir gefunden .
3_5,in Neue Wohnung,in PREP Acc,Neue ADJA Pos|Fem|Acc|Sg|_|,Wohnung N Fem|Acc|Sg,Wann bist du in Neue Wohnung ?
4_6,der Wohnung,der ART Def|Fem|Dat|Sg,Wohnung N Fem|Dat|Sg,Wie große ist der Wohnung ?
5_7,bei der Wohnungssuche hilfe,bei PREP Dat,der ART Def|Fem|Dat|Sg,Wohnungssuche N Fem|Dat|Sg,hilfe N Fem|Dat|Sg,Ich kaufe bei der Wohnungssuche hilfe .
5_8,Wohnungssuche hilfe,Wohnungssuche N Fem|Dat|Sg,hilfe N Fem|Dat|Sg,Ich kaufe bei der Wohnungssuche hilfe .
6_9,ein Antwort,ein ART Indef|_|_|Sg,Antwort N Neut|Acc|Sg,Schreibst mir ein Antwort bitte !
7_11,von Julia,von PREP _,Julia N Fem|_|Sg,Gruße von Julia
