Liebe Julia,Liebe N _|_|_,Julia N Fem|_|Sg,"Liebe Julia , wir geht es dir ?"
Liebe Julia,Liebe N _|_|_,Julia N Fem|_|Sg,"Liebe Julia , wir geht es dir ?"
´,´ N _|Nom|Sg,Mir geht ´ s gut .
für einen Wochenendausflug,für PREP Acc,einen ART Indef|Masc|Acc|Sg,Wochenendausflug N Masc|Acc|Sg,"Ich habe eine Fahrkarte für einen Wochenendausflug gekauft , aber ich kann leider nicht fahren , weil ich ein Spielt habe ."
ein Spielt,ein ART Indef|Neut|Acc|Sg,Spielt N Neut|Acc|Sg,"Ich habe eine Fahrkarte für einen Wochenendausflug gekauft , aber ich kann leider nicht fahren , weil ich ein Spielt habe ."
nach Spanien,nach PREP Dat,Spanien N Neut|Dat|Sg,Also ich wollte nach Spanien fahren .
am Samstag Mai,am PREP Dat,Samstag N _|Dat|Sg,Mai N Masc|Dat|Sg,In 2 Wochen am Samstag 19. Mai um 13h10 .
für einen Wochenendausflug,für PREP Acc,einen ART Indef|Masc|Acc|Sg,Wochenendausflug N Masc|Acc|Sg,"Ich habe eine Fahrkarte für einen Wochenendausflug gekauft , um nichst.Glücklicherweise bist du da ."
nichst.Glücklicherweise,nichst.Glücklicherweise N _,"Ich habe eine Fahrkarte für einen Wochenendausflug gekauft , um nichst.Glücklicherweise bist du da ."
meine Fahrkate,meine ART Fem|Acc|Sg,Fahrkate N Fem|Acc|Sg,"Deswegen frage ich , ob du meine Fahrkate haben möchtest ."
meine Fahrkate,meine ART Fem|Nom|Sg,Fahrkate N Fem|Nom|Sg,"Das ein Geschenk für dich Ha , ich hatte fast vergessen , meine Fahrkate läuft nur 3 tags ab ."
Stefan,Stefan N Masc|_|Sg,Stefan
